{
    "$schema": "http://json-schema.org/draft-07/schema#",
    "$id": "urn:plasmazones:schema:pointer-metadata",
    "title": "PlasmaZones Pointer Shader Metadata",
    "description": "metadata.json for a bundled or user pointer shader pack (trails, halos, click ripples, sparks). Core identity and the parameter contract are enforced. Optional placement and multipass keys (layer, reach, reachParam, trailSeconds, needsCursor, multipass, bufferShaders, bufferFeedback, bufferScale, animated, vertexShader, textures), named parameter presets and descriptive metadata (description, author, version, category, preview) are allowed through.",
    "type": "object",
    "required": ["id", "name", "fragmentShader", "parameters"],
    "additionalProperties": false,
    "properties": {
        "id": { "type": "string", "minLength": 1 },
        "name": { "type": "string", "minLength": 1 },
        "description": { "type": "string" },
        "author": { "type": "string" },
        "version": { "type": "string" },
        "category": { "type": "string" },
        "preview": { "type": "string" },
        "fragmentShader": { "type": "string", "minLength": 1 },
        "vertexShader": { "type": "string" },
        "layer": {
            "type": "string",
            "enum": ["below", "above"],
            "description": "Where the pack paints relative to the cursor sprite. below (the default) paints under KWin's cursor and never touches cursor visibility. above hides the cursor while the pack is live and the host paints the sprite itself after the chain."
        },
        "reach": {
            "type": "number",
            "minimum": 1,
            "maximum": 1024,
            "description": "How far (logical px, default 64) from any trail point or press point the pack may paint. The host derives the damage rect from it, so painting outside it gets clipped."
        },
        "reachParam": {
            "type": "string",
            "description": "Name of an int or float parameter whose resolved value replaces reach."
        },
        "trailSeconds": {
            "type": "number",
            "exclusiveMinimum": 0,
            "maximum": 60,
            "description": "How long (seconds, default 1.0) after the last motion or button event the pack still needs frames. The host keeps repainting for that long, then stops until the next event. This is a liveness figure and nothing else. What spaces the history's samples is how far back the pack READS, which defaults to this but should be declared separately through trailWindowParam or trailWindowSeconds whenever the two differ."
        },
        "trailWindowSeconds": {
            "type": "number",
            "minimum": 0,
            "maximum": 60,
            "description": "How far back (seconds) the pack's stages actually read the trail, when that is a fixed figure rather than a slider. Defaults to trailSeconds. This is what spaces the history's slots, so a pack that needs frames for two seconds but only ever looks at the last half second of path should say so and get a four times finer stroke for it."
        },
        "trailWindowParam": {
            "type": "string",
            "description": "Name of an int or float parameter whose resolved value replaces trailWindowSeconds, the same shape reachParam has over reach. Use it when how far back the pack reads is a slider, such as a trail's lifetime, so shortening the tail buys a finer stroke for it."
        },
        "samplesTrail": {
            "type": "boolean",
            "description": "Whether any stage reads uPointerTrail. Defaults true. A click pack that draws only at the press point should set it false, so its trailSeconds keeps its own animation running without coarsening the sample spacing of the trail packs beside it."
        },
        "needsCursor": {
            "type": "boolean",
            "description": "Bind the cursor sprite as uCursorSprite and set uPointerFlags.x to 1."
        },
        "animated": {
            "type": "boolean",
            "description": "Accepted for parity with the other families and ignored. Pointer packs always tick while live."
        },
        "multipass": { "type": "boolean" },
        "bufferShaders": {
            "type": "array",
            "items": { "type": "string" },
            "maxItems": 2
        },
        "bufferScale": { "type": "number", "minimum": 0.03125, "maximum": 1.0 },
        "bufferFeedback": { "type": "boolean" },
        "textures": {
            "type": "array",
            "maxItems": 3,
            "items": {
                "type": "object",
                "required": ["path"],
                "additionalProperties": false,
                "properties": {
                    "path": { "type": "string", "minLength": 1 },
                    "wrap": { "type": "string", "enum": ["clamp", "repeat", "mirror"] }
                }
            }
        },
        "presets": {
            "type": "object",
            "maxProperties": 64,
            "description": "Named parameter presets. Each value is a map of parameter id to value, naming a subset of the pack's declared parameters. A preset id is its key here, and it is also the label the picker shows, so it has to read as a name. That rules out control and bidi-formatting characters, and anything longer than a label can show. Unlike a user preset id it never becomes a filename, because duplicating a pack preset mints a fresh UUID. A null value is allowed and means the preset says nothing about that parameter, so it keeps the pack's default; the loader drops the entry. Those rules are checked by plasmazones-shader-validate rather than here, because the vendored JSON-schema validator rejects every name under a propertyNames rule, legitimate ones included.",
            "additionalProperties": {
                "type": "object",
                "maxProperties": 48,
                "additionalProperties": { "type": ["number", "string", "boolean", "null"] }
            }
        },
        "parameters": {
            "type": "array",
            "minItems": 0,
            "maxItems": 48,
            "items": { "$ref": "#/definitions/parameter" }
        }
    },
    "if": {
        "properties": { "multipass": { "const": true } },
        "required": ["multipass"]
    },
    "then": {
        "required": ["bufferShaders"],
        "properties": {
            "bufferShaders": { "minItems": 1 }
        }
    },
    "definitions": {
        "parameter": {
            "type": "object",
            "required": ["id", "name", "type", "default"],
            "properties": {
                "id": { "type": "string", "minLength": 1 },
                "name": { "type": "string", "minLength": 1 },
                "description": { "type": "string" },
                "group": { "type": "string" },
                "type": {
                    "type": "string",
                    "enum": ["float", "int", "bool", "color"],
                    "description": "Marshalling type of the uniform. An unknown type cannot be bound, so it is rejected. No image type here: the pointer loader refuses one because neither the slot translator nor the preamble maps it, so declare a texture in the top-level textures array instead, where it binds as uTexture<N>."
                },
                "default": {
                    "type": ["number", "string", "boolean"],
                    "description": "Default value. Use a string for color (#aarrggbb), a number for float or int, and a boolean for bool."
                },
                "min": { "type": "number" },
                "max": { "type": "number" },
                "step": { "type": "number" }
            },
            "additionalProperties": false
        }
    }
}
