{
    "id": "windtrail",
    "name": "WindTrail",
    "description": "A smooth curved ribbon streams behind the pointer, widest where you were moving fastest and narrowing along its length toward the older end. It appears once the pointer passes the activation speed and fades away again as the pointer comes to rest. A fast flick leaves a long thick streak and a slow drag leaves a thin one. The path is smoothed before it is drawn, so an unsteady hand still gets a clean curve.",
    "author": "PlasmaZones",
    "version": "1.0",
    "category": "Trail",
    "fragmentShader": "effect.frag",
    "layer": "below",
    "reachParam": "thickness",
    "trailSeconds": 1.4,
    "trailWindowParam": "lifetime",
    "parameters": [
        {
            "id": "thickness",
            "name": "Thickness",
            "type": "float",
            "default": 14.0,
            "min": 4.0,
            "max": 64.0,
            "description": "Width of the ribbon at full speed (px)"
        },
        {
            "id": "intensity",
            "name": "Intensity",
            "type": "float",
            "default": 0.9,
            "min": 0.0,
            "max": 2.0,
            "description": "Brightness of the ribbon"
        },
        {
            "id": "lifetime",
            "name": "Lifetime",
            "type": "float",
            "default": 0.5,
            "min": 0.1,
            "max": 1.2,
            "description": "How long a point on the path stays lit at full speed (seconds)"
        },
        {
            "id": "activationSpeed",
            "name": "Activation speed",
            "type": "float",
            "default": 120.0,
            "min": 0.0,
            "max": 2000.0,
            "description": "Pointer speed below which the ribbon is not drawn (px per second), 0 to always draw"
        },
        {
            "id": "smoothing",
            "name": "Smoothing",
            "type": "float",
            "default": 0.6,
            "min": 0.0,
            "max": 1.0,
            "description": "How much the path is smoothed before it is drawn, 0 to follow it exactly"
        },
        {
            "id": "color",
            "name": "Colour",
            "type": "color",
            "default": "#ff22d3ee",
            "description": "Colour of the ribbon"
        }
    ]
}
